category,question,context,answer
Population,What group studied?,"In recent weeks, several states have released demographic data that highlights the disproportionate rate of COVID-19 infections in racial/ethnic minorities",racial/ethnic minorities
Population,What group studied?,"For example, increasingly poor health is associated with poverty, lack of education, and racial minority status. ","poverty, lack of education, and racial minority status"
Population,What group studied?,People with disability belong to a population with a higher prevalence of multiple chronic conditions,People with disability
Population,What group studied?,"Respondents with poor mental health were significantly more likely to be women, younger and single/separated/divorced/widowed than those not reporting poor mental health",poor mental health
Population,What group studied?,"If exposed, people experiencing homelessness might be more susceptible to illness or death due to the prevalence of underlying physical and mental medical conditions",people experiencing homelessness
Population,What group studied?,"Homelessness, hunger and job insecurity are important determinants of health outcomes.",Homelessness
Population,What group studied?,Lower socioeconomic status compounded privacy challenges due to crowded living conditions,Lower socioeconomic status
Population,What group studied?,Ethnic minority communities are also more likely to be socioeconomically disadvantaged,Ethnic minority communities
Population,What group studied?,"This second wave emerged in a migrant worker community with low socioeconomic indicators, overcrowded housing, and less access to healthcare and testing.",migrant worker community
Population,What group studied?,"Co-habiting in inter-generational familial units, differences in educational background, professional roles, socioeconomic status and health-seeking behaviours are different in BAME communities compared to White individuals",BAME communities
Population,What group studied?,"During the SARS outbreak in 2003, health care workers performing intubations were shown to be at a significantly increased risk of nosocomial transmission",health care workers
Population,What group studied?,This process aims to detect asymptomatic patients and suspected patients of COVID-19,asymptomatic patients and suspected patients
Population,What group studied?,"In fact, LGBTQ+ persons have a significant history of dehumanizing and marginalizing experiences when interacting with healthcare systems and professionals",LGBTQ+ persons
Population,What group studied?,"In particular, racial and ethnic minorities may be at a particular disadvantage as many already assume the status of a marginalized group.",racial and ethnic minorities
Population,What group studied?,"Among countless other difficulties and risks faced by those who have housing instability, increased risk for disease transmission in homeless shelters is particularly important now.",those who have housing instability
Population,What group studied?,"Older or isolated individuals may have limited or no access to grocery stores and may rely on family, neighbours and home delivery services.",Older or isolated individuals
Population,What group studied?,Lack of access to school-based clinics was noted to be have disproportionate impact on communities with high rates of poverty and marginalized groups,communities with high rates of poverty and marginalized groups
Population,What group studied?,"Pediatricians, health service researchers, and policy makers are not at all surprised to read headlines about the disproportionately high numbers of COVID-19 deaths among the poor, underrepresented minorities","poor, underrepresented minorities"
Population,What group studied?,The outbreak's impact will also be acutely felt by disadvantaged and underprivileged children. ,disadvantaged and underprivileged children
Population,What group studied?,"Sadly, underrepresented populations, patients living in rural communities, and those with poorer socioeconomic status are likely to be disproportionately affected",underrepresented populations
Population,What group studied?,Financial insecurity for older people may be further exacerbated by the collapse in the stock market and low interest rates worldwide,older people
Population,What group studied?,This essay will discuss the ways COVID-19 has adversely affected vulnerable workers including (1) disproportionate representation of workers from low-income and racial/ethnic minority backgrounds in sectors most affected by COVID-19,low-income and racial/ethnic minority backgrounds
Population,What group studied?,"Further, in low-income countries around the world where 50-75% of the urban population lives in slums or informal settlements, the difficulties of social distancing for those with a disability",low-income countries
Population,What group studied?,Much of the health research on the built environment reveals that the health of those in urban areas tends to be worse than that of those residing in less urbanised areas,those in urban areas
Population,What group studied?,"COVID-19 infection seems to be particularly widespread and/or lethal in nursing homes, among homeless people, in prisons, and in disadvantaged minorities","nursing homes, among homeless people, in prisons, and in disadvantaged minorities"
Population,What group studied?,Individuals in higher socioeconomic groups have more physical multimorbidity than those in lower socioeconomic groups,lower socioeconomic groups
Population,What group studied?,"A consistent feature of underprivileged people's living arrangements is overcrowding, which has enormous physical and mental health impacts on occupants",underprivileged people
Population,What group studied?,"Younger adults (OR=2.17-6.81), women (OR=1.59), people with low income (OR=1.3), the economically inactive (OR=1.3-2.04)",people with low income
Population,What group studied?,"SARS-CoV-2 is a zoonotic single-stranded RNA virus of the Coronaviridae family, which has crossed species to infect humans",
Population,What group studied?,"Within local communities, a variety of measures can also be taken to prevent further spread",
Population,What challenge discussed?,The Coronavirus disease 2019 (COVID-19) pandemic has unveiled the stark racial disparities that are present in United States (US) and other developed countries today.,stark racial disparities
Population,What challenge discussed?,"Yet, there is also a tension in public health ethics: if we only focus on saving as many lives as possible (eg, rationing care based on comorbidities), we will perpetuate disparities because good health is not equally distributed throughout society.",good health is not equally distributed throughout society
Population,What challenge discussed?,"Besides people of older age and presence of health conditions, population descriptors identified as more at risk for severe disease include lower socioeconomic status, homelessness, living in densely populated communities",population descriptors identified as more at risk for severe disease
Population,What challenge discussed?,"Conclusions: In this sample of UK adults self-isolating/social distancing females, younger age groups, those with a lower annual income, current smokers and those with physical multimorbidity were associated with higher levels of poor mental health",associated with higher levels of poor mental health
Population,What challenge discussed?,The quality of online mental health services in low-income and most middle-income countries is difficult to be guaranteed,quality of online mental health services in low-income and most middle-income countries
Population,What challenge discussed?,"If exposed, people experiencing homelessness might be more susceptible to illness or death due to the prevalence of underlying physical and mental medical conditions",might be more susceptible to illness or death
Population,What challenge discussed?,Low utilization of online mental health services (as low as 3.7% of participants have used mental health services since the outbreak of Covid-19),Low utilization of online mental health services
Population,What challenge discussed?,"Furthermore, persons who already have limited access to healthcare could be further compromised, specifically those who are ethnic minorities, have a low income, and experience food insecurity and housing instability",persons who already have limited access to healthcare could be further compromised
Population,What challenge discussed?,"Further, in low-income countries around the world where 50-75% of the urban population lives in slums or informal settlements, the difficulties of social distancing for those with a disability",difficulties of social distancing
Population,What challenge discussed?,"During the SARS outbreak in 2003, health care workers performing intubations were shown to be at a significantly increased risk of nosocomial transmission",significantly increased risk of nosocomial transmission
Population,What challenge discussed?,"In fact, LGBTQ+ persons have a significant history of dehumanizing and marginalizing experiences when interacting with healthcare systems and professionals",significant history of dehumanizing and marginalizing experiences
Population,What challenge discussed?,Lack of access to school-based clinics was noted to be have disproportionate impact on communities with high rates of poverty and marginalized groups,Lack of access to school-based clinics
Population,What challenge discussed?,What COVID-19 and the associated gender-based policy have magnified is the endemic and routine nature of violence and marginalization experienced by transgender communities,endemic and routine nature of violence and marginalization
Population,What challenge discussed?,"While this is a necessary precaution, closures will disproportionally harm children in poverty, from low-income families and racial and ethnic minority groups",closures will disproportionally harm children in poverty
Population,What challenge discussed?,"We also know that particular social groups defined by gender, ethnicity, religion or minority status, such as disability, new migrants and refugees, are impacted by health inequalities. ",impacted by health inequalities
Population,What challenge discussed?,"Sadly, underrepresented populations, patients living in rural communities, and those with poorer socioeconomic status are likely to be disproportionately affected",likely to be disproportionately affected
Population,What challenge discussed?,Financial insecurity for older people may be further exacerbated by the collapse in the stock market and low interest rates worldwide,Financial insecurity
Population,What challenge discussed?,"Early on in the 2003 SARS epidemic, the risk of nosocomial spread of infection to HCW posed a critical challenge",risk of nosocomial spread of infection
Population,What challenge discussed?,"Disparities in vaccination coverage may be attributed to socio-economic factors, health literacy, insurance status or entitlement to care, mobilit",Disparities in vaccination coverage
Population,What challenge discussed?,"COVID-19 infection seems to be particularly widespread and/or lethal in nursing homes, among homeless people, in prisons, and in disadvantaged minorities","widespread and/or lethal in nursing homes, among homeless people, in prisons, and in disadvantaged minorities"
Population,What challenge discussed?,The prevalence of physical multimorbidity increased with increasing socioeconomic status,multimorbidity increased with increasing socioeconomic status
Population,What challenge discussed?,"Though no data has been collected, it is likely that health inequalities brought about by advanced age and social frailty 36 (poorer social economic status and social support) can result in reduced health and social care access and influence health outcomes for the affected older persons, which in turn would impact on population management and outcomes.",health inequalities brought about by advanced age and social frailty
Population,What challenge discussed?,"An extensive analysis of the drivers of experience-based individual food insecurity show that the variables significantly impacting food insecurity are related to social, demographic and economic characteristics of the population,","variables significantly impacting food insecurity are related to social, demographic and economic characteristics"
Population,What challenge discussed?,"A consistent feature of underprivileged people's living arrangements is overcrowding, which has enormous physical and mental health impacts on occupants",overcrowding
Population,What challenge discussed?,"Even as states limit individual freedoms to address this public health emergency-assuring that such limitations are reasonable, proportionate, nondiscriminatory, and grounded in law 10 -it is crucial to consider the population-level impacts of the disease and give special attention to the disproportionate risks faced by marginalised and disadvantaged populations",disproportionate risks faced by marginalised and disadvantaged populations
Population,What challenge discussed?,"It has previously been documented that online research and eHealth approaches are less likely to reach more marginalized populations, such as people of color, homeless people, and LGBTQ youth ",online research and eHealth approaches are less likely to reach more marginalized populations
Population,What challenge discussed?,Deprivation increases the risk of poor health; higher levels of comorbidity in more disadvantaged groups,higher levels of comorbidity in more disadvantaged groups
Population,What challenge discussed?,COVID-19-associated mental health risks will disproportionately hit children and adolescents who are already disadvantaged and marginalized,mental health risks will disproportionately hit children and adolescents who are already disadvantaged
Population,What challenge discussed?,"Not only are the urban poor disproportionately affected by urban crises like Covid-19, the policy interventions intended to address them will inadvertently erode what resilience poor households have built to survive.",urban poor disproportionately affected
Population,What challenge discussed?,"In particular, racial and ethnic minorities may be at a particular disadvantage as many already assume the status of a marginalized group",racial and ethnic minorities may be at a particular disadvantage
Population,What is solution?,The crucial challenge is to enable patients to receive medical interventions as early as possible and of as good quality as for people without mental disorders,enable patients to receive medical interventions as early as possible
Population,What is solution?,"Mathematical models suggest that even with widespread testing and contact tracing, in the absence of a COVID-19 vaccine, physical distancing will be a key intervention to prevent community transmission globally",physical distancing will be a key intervention to prevent community transmission
Population,What is solution?,"Interventions at the population level should be repurposed, developed, and tested in a virtuous loop to create the necessary evidence base","Interventions at the population level should be repurposed, developed, and tested"
Population,What is solution?,"In addition, psycho-education should be a central point for patients followed on an outpatient basis, and could take the form of prevention leaflets on the precautions to be taken to preserve mental health in a period of confinement, and on the continuity of treatment.",psycho-education should be a central point for patients followed on an outpatient basis
Population,What is solution?,"To control the transmission of the coronavirus and avoid nosocomial infection, triage procedures based on epidemiology were implemented in a local hospital of the city",triage procedures based on epidemiology were implemented
Population,What is solution?,"First, personal and hand hygiene are the gold standard approach toward minimizing the possibility of infection ",personal and hand hygiene
Population,What is solution?,An effective screening and management process in the outpatient clinic for patients requiring hospitalization during the COVID‐19 pandemic,screening and management process
Population,What is solution?,COVID‐19: implementing sustainable low cost physical distancing and enhanced hygiene,physical distancing and enhanced hygiene
Population,What is solution?,Policy reform should support states with flexibility to implement school-based meal programs which ensures continuity and avoids disruptions,implement school-based meal programs
Population,What is solution?,"By April 1, 2020, general preventive measures including recommendations for frequent handwashing, social distancing, and curfews or stay-at-home orders have been sanctioned","frequent handwashing, social distancing, and curfews"
Population,What is solution?,Single-session psychological debriefing approaches should be avoided as they may cause additional harm ,Single-session psychological debriefing approaches should be avoided
Population,What is solution?,"Social or physical distancing is the act of deliberately increasing the space between people to avoid spreading an illness, and is the most important recommendation from CDC as a community mitigation strategy to limit the spread of COVID-19",Social or physical distancing
Population,What is solution?,This could include a public health campaign explaining why quarantine is important,public health campaign explaining why quarantine is important
Population,What is solution?,"Online and telephone support needs to be provided for vulnerable groups, especially those living alone",Online and telephone support needs to be provided
Population,What is solution?,Research is urgently needed to generate evidence to inform health policy and health system responses to multimorbidity,Research is urgently needed to generate evidence to inform health policy
Population,What is solution?,We must address these issues to ensure that testing is available and accessible to those who seem to be at highest risk of ending up hospitalized and needing intensive care. Navigators can also help patients receive and interpret results through a communication channel that works for the patient,ensure that testing is available and accessible to those who seem to be at highest risk
Population,What is solution?,"We need robust data to guide these efforts, but better information must be coupled with urgent and effective action to decrease exposure, susceptibility, and limitations in health care to achieve the desired results. ",urgent and effective action to decrease exposure
Population,What is solution?,The SARS-CoV-2 response must prioritize access to testing in congregate settings and ensure access to shelters that can follow isolation and quarantine recommendations.,prioritize access to testing in congregate settings and ensure access to shelters
Population,What is solution?,"As we attempt to reconvene our peer-delivered intervention groups and individual sessions, we are finding that our participants have very little, if any, familiarity with applications such as Zoom, and require extensive technical assistance to install, set up, register for, and use these programs.",require extensive technical assistance
Population,What is solution?,Research is needed to assess the implications of policies enacted to contain the pandemic on mental health of children and adolescents,Research is needed to assess the implications
Population,What is solution?,"These associations should consider issuing guidelines that physicians and nurses desperately need to treat and prioritize patients who most need these resources, especially in disparity settings",issuing guidelines that physicians and nurses desperately need to treat and prioritize patients
Population,What is solution?,A systematic review showed promising effects on parenting of technology-based programs in low-and middle-income countries that focused on children's social-emotional behavior.,technology-based programs in low-and middle-income countries that focused on children's social-emotional behavior
Population,What is solution?,"Instead, interventions justified by Covid-19 should be consultative and forward looking",interventions justified by Covid-19 should be consultative
Population,What is solution?,"Ration resources (24-hour bed, investigations, staff expertise) to solve problem within reasonable limits",Ration resources
Population,What is solution?,Novel telehealth-based models have been pioneered and developed in resource-limited settings,Novel telehealth-based models
Population,What is solution?,"Results of such studies can be factored into governments' COVID-19 forward planning policies, such as vitamin D supplementation for at risk groups",vitamin D supplementation for at risk groups
Relevant Factors,What containment method?,"With contact tracing, the proportion q of individuals exposed to the virus is quarantined.",contact tracing
Relevant Factors,What containment method?,"We assume the lock down intervention had an immediate effect to reduce the disease transmissibility, plus another lasting effect that strengthens following the lock down",lock down
Relevant Factors,What containment method?,Other sporting events were forced to cancel when local and state governments restricted the sizes of gatherings,restricted the sizes of gatherings
Relevant Factors,What containment method?,This paper aims at analyzing the effect on the US air transportation system of the travel restriction measures implemented during the COVID-19 pandemic from a passenger perspective,travel restriction
Relevant Factors,What containment method?,"To restrict contact among individuals, governments have imposed unprecedented public health measures such as travel bans, workplace distancing, and schools closure","travel bans, workplace distancing, and schools closure"
Relevant Factors,What containment method?,"In this case, quarantine means the identification and isolation of infected individuals",quarantine
Relevant Factors,What containment method?,"In 87 particular, the model includes quarantine of asymptomatic suspected population 88 (exposed) and isolation of symptomatic and infectious patients",isolation of symptomatic and infectious patients
Relevant Factors,What containment method?,"The model, which incorporates the main non-pharmaceutical interventions being implemented to curtail COVID-19 transmission in a community (such as social-distancing, quarantine of suspected cases, isolation of confirmed cases, contact-tracing, testing and use of face-masks in public)","social-distancing, quarantine of suspected cases, isolation of confirmed cases, contact-tracing"
Relevant Factors,What containment method?,"Indeed, an asymptomatic individual will maintain a high contact rate, and thus might infect more susceptible individuals with respect to an infectious individual with symptoms that is in quarantine",quarantine
Relevant Factors,What containment method?,"Public health interventions, such as home quarantine or school closures, may be based on the cumulative prevalence of detected symptomatic cases",quarantine or school closures
Relevant Factors,What containment method?,"In addition, Italy applied non-pharmaceutical interventions based on physical distancing, school and store closures, workplace distancing, to avoid crowded place","physical distancing, school and store closures, workplace distancing"
Relevant Factors,What containment method?,We assume that exposed individuals E(t) and quarantined exposed individuals E q (t) are transmitted to infectious individuals I(t) and quarantined infectious individuals I q (t) with the same transition rate of ν,quarantined
Relevant Factors,What containment method?,"After isolation is enforced, we have a model for the isolated population",isolation
Relevant Factors,What containment method?,Isolation of symptomatic cases and home quarantine of asymptomatic contacts is recommended,Isolation
Relevant Factors,What containment method?,"Basically, in this case the quarantines do not have the effect of isolating potential infected individuals but rather to reduce the number of susceptible individuals that could have a contact 9 .",quarantines
Relevant Factors,What containment method?,"If large-scale community transmission occurs, mitigating social gatherings, temporary school closure, home isolation, close monitoring of symptomatic individual, provision of life supports (e.g.","mitigating social gatherings, temporary school closure, home isolation"
Relevant Factors,What containment method?,"Using previous assumptions around travel restrictions (Chinazzi et al., 2020) , we also modeled two scenarios where federal travel restrictions reduced passenger volume by 40% and by 90% from the restricted countries ( Figure 2E ).",travel restrictions
Relevant Factors,What containment method?,"Although the above interventions greatly reduced the human mobility, Wuhan lock-down combined with nationwide traffic restrictions and Stay At Home Movement do have a determining effect on the ongoing spread of COVID-19 across China Mainland.",lock-down
Relevant Factors,What containment method?,"We find that social distancing measures had a large effect in the provinces, where moreover higher transmissibility appears to have triggered more effective protection.",social distancing
Relevant Factors,What animals?,"In the case of COVID-19, similar to SARS, wild animals are considered to be the original hosts which then infected other animals (present in wet markets), which transmitted the disease to humans",wild animals
Relevant Factors,What animals?,"Coronaviruses caused diseases in mammals and birds, a zoonotic virus that is transmitted between animals and people",mammals and birds
